stars,text
5,"Honestly the best part of this place is the unbelievable deal you can get on pet related products. Because they are one of the primary income sources for HALO Animal Rescue, people that have pets, tend to make donations. You can almost always find pet carriers for under $10. They have dog crates for training and you don't have to shell out a fortune for them. They have fish tanks that will allow you to let little Johnny get his feet wet in the world of pet care and the associated responsibilities without breaking the bank. If you are a person that shares your life with animals, you understand the rarity of these kinds of deals!

Yes they have clothes, furniture, tchatchkies, etc., but the real deals are on the pet products.

As a side note, HALO recently leased the MCCAC location at 5231 North 35th Avenue (It was the previous Maricopa County run cat adoption center). So if you are looking for a companion (cat or dog), check them out and support one of the fastest growing no-kill efforts in the US.
http://www.halorescue.org/index.html"
5,"We tried this last night for our date night.  We were impressed.  The waitress was amazing in explaining the menu and making suggestions. This is a great place to relax and talk.  The food was great.  I had the Tartiflette...WOW it was so good.  My husband had the La Potence, which is their speciality.  He thought it was great...We will be back..."
5,"Greatness in the form of food, just like the other locations. 

The service was particularly good at this location. We sat at the bar,and while the other customers were mildly annoying, the late night bartenders were up beat, witty, and very personable.

The atmosphere was par for the course.

All in all, if you are reading this review, get your directions to this location, close the browser, and go eat!"
5,"I have totally fallen in love at Tuck Shop.  Everything here is fantastic.  My friend and I come here about twice a month and enjoy some snacks and wine.  The beer battered Cheese Curds may just change your life for the better... we are seriously tempted to each get our own order. 

(I am not very good at sharing and i always get what I want!   ...No i'm not an only child... well, maybe I was until i was 11, how did you know.  WAH!)   

Oh, and Laura is fantastic.  She always takes great care of us as we enjoy a glass of wine on the couch in the reading room.  

Thursday's special is meat loaf... don't deny yourself, just indulge.  :)"
5,"I love this place! Great place to grab a quick smoothie or stay to hang out! (just let them know if you're in a  hurry)

P.S. The phone number is area code 480 not 490 :)"
5,"Every time I go into this place its with good times and cheery mates and I leave the wiser with a pint of fresh brew and some of the best food. 

To make a great date, go to the Phoenix Rock Gym first and then climb the ladder on the back wall and walk in around the back...Great times for every one!"
5,"Great selection of vitamins and supplements, good prices and I can get the special treats our cat likes while I'm picking up the goods for myself. Plus their rewards program is pretty straightforward.

I also like that they are not ""all over you"" like the other local chain is when you walk in the door. 

I highly recommend the Vitamin Shoppe on Camelback!"
5,"Eating in is a decent experience, but for delivery, I have yet to meet their match.  When I order delivery I always get a 16"" chicken pizza with alfredo sauce on top, and for the last 6 years I have received it in 30 minutes or less all but 2 times.  Its always tasty, fresh, and is my preeminent food for delivery, ever, period."
5,"Pizzeria Bianco: Before and After 
Cited as ""the best pizza in America"" in numerous on-line reviews as well as on Good Morning America and as published in, Slice of Heaven, to most pizza lovers the three to four hour wait for a table is so daunting that they push on to a more open table atmosphere for their pizza experience. But to the true pizza enthusiast, Pizzeria Bianco is as much about the experience as it is the food. This place is best known for the owner Chris Bianco, hand tossing each and every pizza pie served every Tuesday through Saturday, from 5-10 pm for nearly 15 years, of which I was one of those fortunate customers. However, early 2010 Chris was forced to retire due to illness and turn over the pizza paddle and oven duties to his protégé of 15 years, Horatio Hernandez. 
My decision to try Pizzeria Bianco for the first time came from a challenge I put upon myself: Find the best food in metropolitan Phoenix. After hearing about Pizzeria Bianco from a friend, I made gourmet pizza my first battle in 2009. I knew about the long lines forming an hour or more before the restaurant opened, and this beautiful fall day was no exception. I arrived 60 minutes before opening and my date went to Bar Bianco to start us off with a couple of pale ale microbrews while I held our place in line. Seeing that there were only about 20 people ahead of us, we assumed we would make the 5:00 seating with no trouble. However, just as we were holding a place for the rest of our party, so were the 20 or so people ahead of us, and when the door opened promptly at 5:00, there were now over 50 people ahead of us. Needless to say we were left waiting another hour since the restaurant seats only about 40 at a time. 
When we were seated at 6:00, the four of us started with the homemade mozzarella, local tomato and sweet basil starter with extra virgin olive oil drizzled all over as well as homemade crusty bread with a dish of EVOO with a touch of balsamic added. We ordered three pizzas, the Sonny Boy providing salami, marinara sauce and gaeta olives, the Wiseguy a sausage and mozzarella taste explosion and the Marinara with Prosciutto di Parma. All three pizzas were piping hot when they arrived, just crisp enough around the edges and loaded with the most amazing flavors your mouth has ever experienced. We left the restaurant without remembering the nearly 3 hour wait and were fully satisfied, eager for the next opportunity to drive to 623 Adams in Phoenix for another ""slice of heaven"". 
And so, after hearing of the departure of Chris from the kitchen, curiosity got the best of me. I had to challenge this place and find out if the changing of the guard made any difference in the wait time, the food quality or the overall experience I had truly fallen for. April 6, 2010 again I ventured down to 623 Adams in Phoenix to see if a Tuesday night or a new head chef had made any difference at all. My date and I arrived at approximately 4:00 pm, one hour before the doors would open. We found a line of about 25 people and looked at each other and said, almost in unison, ""Well, the wait hasn't changed"". 
Bob trotted off to Bar Bianco to find our pale ale, Four Peaks to help pass the time. We caught a glimpse of owner Chris Bianco and I told Bob how I would love to chat with him seeing as I was writing a comparison review, I also wanted to find out who was cooking tonight. Bob stalked Chris into Bar Bianco and asked him if he had any time, would he be willing to take a picture with me and answer a couple of questions. When Bob returned with another beer and Chris Bianco in tow, I was star struck and could barely speak. All I could muster up was, ""Are you cooking tonight?"" To which he replied, ""No, I have Horatio at the oven. I can't cook anymore."" I explained my evaluative writing topic and he assured me the experience would be the same. We took a picture and off he went, back to the bar. 
At 6:15pm, after 2.25 hours of complete social enjoyment we were called to our seats at the bar. We ordered the same items we had enjoyed last fall with the exception of the Marinara. The overall experience was better for me as I got to enjoy personal time with Chris. As for the meal, it was just as amazing as I remembered it from 6 months prior with Chris tossing the pie for every customer. The flavors were exactly as I remembered and the service from the staff was top notch, just like the first time. From the wait to the taste, it didn't appear that anything had changed! 
So what makes for the ""best pizza in America"" and how did Pizzeria Bianco get the tag line? Well, my opinion is flavorful ingredients, a phenomenal social experience, and an owner who lives by what he serves. To Chris Bianco and the Pizzeria Bianco staff, you haven't skipped a beat!"
5,Love it and love the GF menu.  It's amazing how many dishes they have
5,"I came here on the opening night when someone from Gin Blossoms played on a makeshift stage, the beers were 25 cents and there was no food (but you know me, we ordered a pizza from a neighborhood pizza place.) Since then, they have added a full kitchen and the food is amazing (chicken strips that were designed for diners who appreciate tempura-like batter and are over the age of four), the beer is astounding (one word: Kolsch...makes me swoon) and the people are great. It's worth the walk wherever you end up finding a space to park--even better, ride your bike over like we do! The Sunday brunch is great. All of my friends sit and wish they had a student loan that would enable them to spend at least half of the day drinking here daily. I don't blame them."
5,"My friend has raved about this place for months, so for her birthday the girls and I got together for a little pizza field trip to LGO. It was amazing! Just as good as Mozza Pizzeria in LA., but around 400 miles closer. I also love the little grocery store. Very cute things to buy."
5,"I found this place via Google while in town for business. It's tucked away in a non-descript strip mall next to a Salvation Army.

I've had dinner and lunch here, both times were good. For dinner, I had the special turkey sandwich with fries (fries weren't pipping hot when they were served, but still good); for the lunch visit, I had the original ""g"" spicy po-boy and chose the curry pasta salad as a side - tasty!

Service was friendly and efficient.
_______________

Update: 
12/10/07 - What's the first thing I do when I arrive in Phoenix? Punch in 2240 N. Scottsdale Road in my GPS and head to Green! This time around I had Thee Argentine Po-Boy with fried - Mock steak fried with onions and peppers, vegan mayo and a spicy sauce. I couldn't get enough! Very delicious

12/11/07 - After having a veggie burger and fries for lunch at a Hard Rock Cafe, I thought I'd balance it out by having something healthy for dinner - I ordered the Diablo Rice bowl with chicken and brown rice. The description looked good: veggies in a spicy sauce - but it was a little too salty for my taste and didn't finish it. Oh well, can't win them all.

12/12/07 - I was working close by, so decided to run in for lunch. I ordered the No Harm Chicken Parm sandwich with a side of tahini coleslaw. It was a little bit messy to eat by hand, with the tomato sauce and soy mozzarella oozing everywhere - still good nonetheless. The coleslaw was a nice compliment to the sandwich.

12/14/07 - I'll miss you Green!"
5,"Great customer service, competitive rates, and I always get a call right back from Jeff! Nice to have an agent who actually cares about his customers. I would recommend giving him a call."
5,"Just off University, but manages to feel like a little hide-away, and pulls off an enticing mellow atmosphere, suitable for intimate conversation.

Fish Tacos and a Margarita again please! How many times before I can force myself to experiment?"
5,"I have lived all over the US, and I have experienced extreme lows and highs with dentists, but this dental group is by far my favorite I have ever been a patient of. I can't say enough good about them, so I won't ramble.... Just love them."
5,"This place does it right, but hold on to your walet! U have to try the Yellow butter cake, its over the top."
5,Best sushi in town.
5,"I came to Timo for my birthday last week after hearing rave reviews about it from a few friends of mine. I met up with the fabulous Jennifer T. and I was so happy to check this place out!

I like any place that I get to walk in through a back door. I passed through the very chill looking patio area first, another plus in my book. Plenty of outdoor seating that looked dangerously inviting once this hot hot heat cools off. Inside was intimate, but with the large windows, it wasn't dark and depressing. Like your own little happy wine bar world.

They have an amazing wood burning oven. Normally, that itself is plenty good enough, but then there's the food that comes out of that wonderful oven. I only tried the spinach and artichoke dip, which was the best I have ever had! It didn't have a pool of oil (first time for everything!), it was so fresh, and I really appreciated seeing the bread sliced fresh right in front of us, since we were sitting at the bar. I saw several other things (flatbread)  come out of that oven, and I will have to go back to try them! Everything smelled delicious and was presented with a touch of class without being pretentious. I was also very intrigued by the eggplant dip which is apparently ""better than baba!"" 

Now for the drinks. Holy cow. I've been drinking a few years now, so safe to say, I've tried many, many drinks. Or so I thought. Coconut mojito anyone!? Made with Ciroc Coconut vodka!  As tasty as mojitos are, I don't get a long well with rum, so vodka was a pleasant surprise, and the coconut just brought the mmmmmazing factor to a whole new level. I also tried the white sangria, another 5 stars. Great wine list too- Apothic Red is one of a few reds I like, and they have it!  

The staff was top notch as well. I arrived shortly before a shift change, and both bartenders were personable and hard working, and truly seemed to enjoy what they were doing. I'm pretty bad with names unfortunately, or I would love to mention them.

I can't wait to go back! For drinks and food! I think I'd even go alone for lunch if I didn't have any company!"
5,"The Boulders was a first class experience all around.  

We stayed in a casita, which was one bedroom and had a sitting room w/fireplace (a letter on the table indicated they are no longer using the fireplaces for environmental concerns), a large bathroom and walk-in closet, and a patio with a table and four chairs.  For the ladies, there is a vanity with lighted mirror just off the bathroom.  My only small complaint about the casita was that the shower was a bit small.  The mini-bar seems to be a thing of the past, but the Boulders still features a well-stocked version with a half bottle of Cali wine, kettle cooked chips, water, soda and various liquor.  The villas were outrageous and would be great for a family reunion or that type of thing - multiple bedrooms, a large outdoor area for entertaining, with the garage (they're houses, really) converted to a bedroom.  If you're staying in a casita, it's a hike across the property to the villas - they'll take you in a shuttle bus.

The bar near the dining room was well-stocked with several single malts, and the standard cigar list.  Walk out back through the seating area, and you'll find the pool, framed by a gorgeous backdrop of a large boulder and waterfall.  A little cool for the pool in December, but it didn't seem to hamper others' enjoyment.

Looking forward to returning and enjoying more on-site amenities besides golf.  My girlfriend went to the spa for massage / pedicure and seemed pretty relaxed - what I gathered is that she enjoyed it.

There are places with cushier accommodations, but the property it sits on is what makes the Boulder's unique."
5,"Not being a big fan of chain restaurants, I wasnt super excited to eat here last night. I was however, starving and craving mexican food and wanting to try somewhere new so we ended up at Manuel's. 

OMG I loved it! The salsa's (especially the hot!) the chips, the cheese crisp with green chiles and onions, and most of all: the chilaquiles!! I LOVE chilaquiles so much and had mostly seen them only served at breakfast until I opened up Manuel's menu and there they were, just how I like them! SO good I wouldve licked the dish they were served in if I wasnt so full afterwards!

JD had a rolled quesadilla that was fantastic too and we both needed to be rolled out of there when we finished eating. It was so good though that I'm craving it again today. We will definitely be back!"
5,"I was visiting Tempe for Ironman Arizona and came down with pretty acute foot injury three days prior to the race.  The friendly receptionist at Dr. Natcher's office understood the predicament I was in and managed to fit me into Dr. Natcher's schedule within a couple hours of my call.  Dr. Natcher's is clearly both a great doctor and a great person; she is extremely competent, friendly, and sympathetic.  As an  runner and cyclist, she is also in tune with sports injuries and the mentality of an athlete. She quickly diagnosed the injury and prescribed an aggressive treatment protocol.  I was in good shape on race day (due to her treatment protocol) and am so very thankful to Dr. Natcher for putting me in the position to complete the race in fine fashion.  I was paying out-of-pocket, and  was very pleasantly surprised by the cost of the office visit.  I can't speak highly enough of my experience with Dr. Natcher."
5,"I hardly ever get past their carne adovada. It's simply amazing. Add a couple of extra homemade tortillas to it? Can't be beat! I have had their pecan crusted sea bass also, along with lamb chops (chipotle?) both very, very good. Great atmosphere, friendly, competent staff...a winning combination. Get there early! Long waits after 6:00pm!!"
5,"Bookmans is Great!  They probably don't need another positive review but so what.  I use Bookmans for recycling books I've read and for buying used books for myself.  All I can say is that I like everything about the way they do business.  They have great people working there.  The store vibe is very positive.  Their prices are very fair and what they pay for your used books is incredibly fair, plus you know that you've made a positive contribution to our society by recycling books that others can enjoy.  Do yourself a favor and stop in.  Enjoy!"
5,"So I knew ahead of time about the wait. So we got there at 3:30 and waited for an hour and a half until they opened. But we were able to be seated as soon as they opened.

Let me just say that I've never had anything even close to the kind of pizza that we got. It's outstanding! 

I highly recommend the caprese salad, antipasto and the rosa pizza. Though I'm pretty sure that it's all amazing, no matter what you get."
5,"We had read about this place on  Yelp and a local had highly recommended it as well.  It is located in an office building and not easy to find unless you know in advance that it is in the back of a big office building with a big parking lot.  I will preface this by saying that we had just eaten the night before at a highly regarded Scottsdale restaurant in which the service was awful.  Therefore, this place won a lot of points with the 4 of us immediately because the service was outstanding from start to finish.  The restaurant itself is huge and it is beautifully decorated and immaculate.  You walk in and they have a huge open fire spit BBQ chickens and Beef.  For starters we had a  Caesar Salad--a shrimp cocktail--a bit pricey and just okay, and a good house salad.  I ordered their simply grilled fish of the day which was Swordfish with Guacomole on top and a corn butter on the side served with rice.  It was a good portion and it was delicious.  My wife had Salmon on a plank which was also very good.  One of our friends had Short Ribs with Dr. Pepper BBQ sauce and grits.  The portion was huge and he raved about the dish. Our other friend had the Duck Breast and it was very good.  We had a nice wine recommended by our waitress that was reasonably priced and very good.  The whole experience was excellent and we will go again when we come back to Scottsdale."
5,I love the menu here it has many selections of many cultures including Italian!!!
5,"Drinking coffee from Cartel makes me want to get my own San Franciscan SF-25B Coffee Roaster, in much the same way I wanted my own pottery wheel after seeing the movie Ghost.

It's. That. Good."
5,"Great place, enjoyed the amenities. Pool was great and view on the property was very picturesque. Food in the property restaurants were very good. Definitely would stay there again if ever in Scottsdale again."
5,"Let's be honest, when you walk into a tanning salon if you have high hopes you'll expect to see a nice person behind the counter who is friendly and can tell you the prices for packages and the max times on the beds.  If you have low expectations you'll expect a bored teenager who hands you a price sheet and stares at you looking bored.

Walking into the Total Tan I had pretty good expectations based on the reviews and even those were blown away.  Dallas was the person who helped me (I think he's one of the owners?) and he was sooooo friendly and knowledgeable I spent more than I was originally planning but I feel good about it actually.

I had looked at the pricing online so I had an idea of what I wanted but he explained things about the beds that I never knew and that none of the other salons I'd been to had ever told me.  He was super personable too, even asking for my name just during his explanations of everything before I had committed to buying anything.  He made sure I knew every detail of the beds, the differences, gave recommendations and was never pushy with any of it.  During our conversation several people came in and he always asked my permission first to take care of them and I don't think he had to ask for their names once, a good sign that he pays attention and remembers his customers.

I could go on and on because I was so impressed with his service and also the location itself (super clean, trendy, nice extras in the rooms like baby wipes and extra towels) but I think you get the point by now.  Just check this place out, you'll be happy you did."
5,"Great experience from start to finish.  Host (who was the owner) seated us at a table with a view.  Was given house made foccacia bread and olive oil.  Was awesome.  Some of the best bread I've ever had before a meal.  The olive oil was seasoned perfectly too.  My grandma got the burger and I got the pesto penne primavera.  The pasta came with shrimp, squash, and some other vegetables.  I love pesto, so this hit the spot.  Good serving size, but not too much.  The food tasted fresh.  They make their own pasta, which was delicious.  The burger was huge.  Looked like you get your moneys worth.  The ice tea was even good.  The place was clean and sleek.  They played good music and the service was perfect.  It has been a while since I had such a good overall experience with no complaints.  I will be coming back.  The host, who we later found out was the owner, was working that night and asked us how we liked everything.  I've said it before, but that is a rare and good touch for any restaurant.  Well done."
5,"This is my favorite spot, waterfalls everywhere, beautiful flowers, fun slide, and great food!"
5,"So my friends and I had to roll each other out of the door after this meal was over but it was sooooooooo worth it!!! BEST red kool-aid ever served in jars!! BEST waffles I've EVER had!! BEST red velvet cake I've EVER had!! I also did enjoy their chicken, mac & cheese and collard greens, but none were the best I've ever had, but very good.  I seriously dream about their waffles and red velvet cake, I don't know what magic mix of ingredients make up the waffle batter but it's absolutely perfect and these waffles would stand deliciously on their own even without butter and syrup, but who'd want to do that? the red velvet slice they give you is HUGE and soooo moist, the frostings is cream cheesy delicousness. I can not wait to indulge in this treat again, but since I'm far from being the only one who loves this place, it is always packed and the wait is long, at least on the weekend. Seriously considering taking a day off of work just for a weekday Lo Lo's run =P"
5,"This place has been here 7 years and we have never been. Are you kidding me? The food is excellent. The people who work here are friendly and seem to be happy to be there, which is most important. I tried the make your own half salad and half sandwich. YUMMY!!! There are many choices for salad toppings. There us nothing I like more than a huge, fresh salad. I chose to top my salad with avocado, tomato, bacon, edemame, feta cheese, and whipped balsamic vinaigrette. I really think this was the best salad I have ever had! They make the salad in front of you and mix in the perfect amount of dressing. I chose the chicken pesto sandwich. The combo of these items was a perfect portion for this hungry girl. The sandwich was excellent. My hubby ordered the Cuban pork sandwich. This is one huge sandwich! It was difficult to get his mouth around it, but once he did, it was awesome!! Typically, we don't like coleslaw, but it was really good, especially combined with the tender pork. We will return to the Market Bistro, again and again. 
Loved it!!!!"
5,"This place has amazing frozen yogurt! I had the strawberry with small pieces of fresh strawberries! It was a wonderful treat in this heat, since it's yogurt and not ice cream, it's a little bit healthier."
5,"I love pita Jungle! Everytime I am in town, I make it a point to get here. The food is fresh and healthy(ish). There ice tea comes in a variety of wonderful flavors and is so delicious. I would recommend you eat here, especially if you like yummy food with a medditeranean flare."
5,"I need to stop going here so much, but it's hard to stay away."
