stars,text
1,OMG! what is the rave about? this place is disgusting! it's dirty and the food is not worth it! i came here with my family and we each order a little bit of everything that is suppose to be good and popular there. unfortunately everything is bad. i walked by the waiters and they were all cursing really loud in vietnamese to each other. the table is icky and it smell like my cooked up oil . ick! go to Pho ao sen instead at least it's clean.
1,"I understand I'm not dude and so I'm not there to state at your ""twin peaks"" however, that being said I am there to buy a beer and when it takes the bartender 20 minutes just to get a beer I'm over it. So I was never gonna come back but was forced with a group of friends who wanted to eat and was just as upset as the first time. Fries were soggy and our server disappeared. We all decided were not going back. Just because your a good looking server doesn't give you an excuse for sucking."
1,"DO NOT GO HERE.  One of the worst restaurant experiences I have ever had.  The setup is a little like ""Pei Wei"" where they take your order, give you a number, and bring the food to your table.  Placed our order, and had to stalk other tables and hover over people eating trying to wait to get a table.  Waited a long time, all the while others who ordered after us found seats and got their food before us. Servers kept bringing my food to me since it was ready, but I still didn't have a table, so they kept saying they would ""put it under the heat lamp"" for me.  Finally eventually found a table, and then kept waiting and waiting for our food, which the manager claimed ""he had them remake"" since it was getting cold.  My food came, and it was cold and disgusting.  We had to get going since we were going to a show, and my mom's food still wasn't there.  The staff asked to see her receipt, since they couldn't find her order.  She went up to the manager and said she just wanted her money back since we had to go (it had been 45 minutes since we placed our order).  He said her food would not be ready for a while, and gave her some cash, and we left.  My mom never even ate, and my food was horrible.  I would NOT recommend this place, it's awful."
1,Donuts are worst I've ever had. I bought 2 dozen donuts using their 10.99 sale and it was the worst donuts I have ever had in my life. All the donuts were dry and stale. I should have gone a couple of miles over and bought Krispy Kreme. Krispy Kreme donuts are always fresh. These ones were worst that those that sat on the shelf for a week in a supermarket!
1,Completely shady.  Towed our U-haul as we were moving in to our new Apartment Complex.  Completely unethical and total crooks.  AVOID AT ALL COSTS!
1,"Look it upsets me that you have to give even one star. 

I can read the other reviews and I have been here more than a few times but tonight it was just beyond a bad dinner. 

Yes, we were the table of 7 people at about 8pm, yes we were group at the high top tables that were pushed together. You would have to remember us because we were the table that had 1/2 of a waiter. It was so nice of you to take the time to take our order and then let the waiter go home because he had been there since lunch. 

You know what sucks more than working 2 shifts? How about being the last table for the guy who worked 2 shifts, it was so nice of the manager to let him leave, but hey how about taking the time to have someone FINISH the open orders? 

Simply the food was not good and you are over priced.

But the worst part is that your staff is just not good at their job, THEY DONT CARE and that is a result of MANAGEMENT not caring."
1,"This Jack in the Box location has the worst service & food that I have found in the Phoenix metro area. Every time I have gone through the drive through there my order has either been wrong or inedible - how hard is it to make a taco without frying it into oblivion? The wait times are consistently more than 5 minutes...I think I will be spending that 5 minutes driving to another location, just to get the correct order & food that is properly prepared."
1,"I was looking into gyms around the area. Upon entering I was greeted by the front desk guy. I asked about memberships and then he said, ""Sorry we are sold out"". I stood there stunned. Then he snickered, ""Just kidding"". Trying to be a good sport I went with it. 

Next came the young sales guy. He was personable - at first anyways. Showed me around the gym and I was interested in joining. Next we went over to the childcare area since I have a little one. Children were in the room however the two girls monitoring the room were chatting it up with one another and ignoring the kids. Bad sign. I asked the girls if they were CPR certified and had fingerprinting and background checks. The world stopped for just a moment and they stared at me. I had interrupted their important conversation. Then they were both saying, ""Yeah, like, well, um, no, I mean yes,"". In other words, no straight answers. 

We sat at the sales guy's desk and the wheeling and dealing began. I felt like I was purchasing a new car. ""If you choose option A, you then can go to all the gyms."" ""If you choose option B, then only here"" . The whole time I could see the children's area and the kids were being completely ignored (and we are talking very little children). When I told the sales man I needed to think about it he switched into some type of Dr. Jekyll, Mr. Hyde routine. ""Well you only have today to make a decision, after that no price guarantee!!!""   From there he was down right rude.

I walked out of there thinking what the heck just happened. Like Sarah G, I felt horrible when I left this gym.  It was an awful experience. Ended up getting a membership at Tangible Fitness on 7th Street. They don't have the same amenities however it is locally owned, and the people are very nice there."
1,"Have been an Ulta customer for a long time, but had never tried the salon until recently.  Was a HORRIBLE experience.  My stylist, Delia, ran 45 minutes late to start me, and on several occasions during the hair cut, stopped and kept looking around.  She made various odd faces as if to say my hair was a mess.  She not only didn't listen to what I wanted, but shot down the only thing I did ask for.  She said I wouldn't look good.  At the end of the painful ordeal, she then charged me for a conditioning service I didn't ask for.  At that point she directed me to the line at the front of the store, after which I waited in, they then sent me back to the salon to make the price correction.  (happened twice, then I asked for a manager)  Was very unprofessional all around and would NEVER go back!!!"
1,"I had not been to an Oregano's in like 10 years. They seems to be popping up all over here in AZ now so my buddy was in from out of town and he wanted to try, so why not.

I'll tell you ""Why NOT""... we has two thin crust pizzas... and I even hate to call them that. More like... crackers with melted cheese and some toppings.

That was some of the worst excuse for pizza I've ever had. Most of the fast-food delivery pizza I've had beats it -- and I do not like, at all, delivery pizza.

Maybe the pan pizza is better than the thin crust... god it could not be worse!

It only deserves one star for the good service... other than that is the another sub-par overpriced ""gourmet"" pizza joint.

If you want expensive, and good, pizza there are many good alternatives... Pizzeria Bianco, Grimaldi's, etc."
1,"I will never make another purchase from this company ever again! The company tried to deliver damaged furniture to my home and then gave me the run around about processing a refund when I refused to accept the items. After 5 phone conversations, they agreed to refund me for refusing damaged items. I cannot recommend this to anyone."
1,"I do enjoy a good bowl of Pho.   This was -not- a good bowl of pho.

grey chicken meat., off tasting broth, old bean sprouts, 1 piece of a jalepeno pepper... dingy insides.  Weird looks from the server.  I don't think I'll be back.  Not much else I can say"
1,"No no no...do not go here, now I'm not talking about the fact that the place looks crappy, or the bathroom is suspect but the fact that the food is nasty. It was completely empty when we were there and that should have been some indication on what to expect but no I am a glutten for punishment. I ordered some tacos and didn't even finish the meal I ended up just tossing the food and still got a tummy ache from what little I did eat. This place is definitely not a good look"
1,"WOW!  I have never been to a place with service this horrible.  I may have caught them on a bad night, but I'm not giving them a second chance to find out!

I came in with a group of 4.  We stood up front for 5-10 minutes before waving someone down to be seated.  That was a mistake..

As we're waiting for a server to take our drink order, we noticed that EVERY single table had empty cups waiting to be refilled, dirty plates that needed bussing, and people with impatient faces.  There was only 1-2 dedicated servers, and they completely ignored us.

We stuck around just to see how long it would take before someone took our drink order, it was like being in the Twilight Zone.  After 30 minutes and flagging down 3 employees, we just walked out laughing, no one had even apologized for the wait, I'm not sure they even saw us leave!  It was the strangest restaurant experience of my life.

What a joke...

**EDIT**  To their credit, right after I posted this review, I received a message explaining that the Director of Operations would like to amend the situation, even going so far as to include their cell number.  I admit that I feel strange posting such a negative statement amid all the 4 and 5 star reviews, I'm assuming I caught them on a really bad night.  I'll edit this if I ever return to the restaurant, but the fact that someone actually reached out to try to rectify things says something"
1,"Where are the managers????   It took 1 1/2 hours for our meal to come out at 8:15 in the evening.  Items came out at different times so we couldn't all eat at the same time.  The asparagus tempura was inedible because they didn't cut the ends.  Waitress just took it away and did not comp us.  Waitress knew next to nothing about the sushi menu.  She sat and talked with the hostess the entire time instead of waiting on her tables.  Food was WAY over priced, and I couldn't speak to my dinner companions because the music was way to loud.  One of the worst dining experiences in a long time.  Paid $70 for a dinner for 4 and went home hungry.  HORRIBLE!"
1,"I brought my sweet sister in law shopping at this Forever 21 location.  She had a bag full of goodies (several hundreds of dollars worth) from H&M.  She stopped at Forever 21 and  sat her bag on the ground right beside her while she tried on a pair of shoes.  Her H&M bag was stolen during that brief moment that the bag was not in her arms.....and while this certainly was not the responsibility of Forever 21....we were so disappointed in the way the Forever 21 staff reacted. They did not call security, or the police, or even offer any condolences.  They just shrugged their shoulders.  My sister in law did love some of the fashions at Forever 21....but the store was such a mess.  There were clothes all over the floor under each and every rack.  There were way too few staff members working, and many who were working were ""socializing"" with one another instead of helping customers or maintaining the store inventory in a decent fashion. The only employees that were on task were:  1 at the checkout, and 1 at the fitting rooms - there was a band of 5 girls dressing one mannequin while the store was amidst in chaos (including someone stealing bags from other customers)..... So - if you choose to shop at this store - hold on to your bags :)"
1,"ok so here's what they teach:  if you are a good person it is right and good for you to take from others and give it to yourself, because you deserve it and everyone else is a bad person.  Stealing is okay, lying is okay, as long as it is done by you, but for the others, they have no place in society, so pillage and destroy them, it is your right and you will be rewarded for that.  Wow."
1,"I came here at noon during spring break. When I walked in, no one was there. I rang the bell on the counter. No one came out from the back. I waited and rang the bell again. Nobody. I waited and rang the bell a third time. No one. I walked out having been unable to even find an employee much less place an order and try the food. Pathetic."
1,"What's with the cheese?  It isn't even Velveta.  It's liquid cheese food and it belongs somewhere other than on my burger.

$5 burger and fries is a great deal IF -- IF -- it's a great deal.  This is just liquid cheese food on a hamburger patty.  McDonald's will do a burger and fries for $5 that's tastier than this dump."
1,"Avoid this einstein's at all cost. I have been laying in bed puking for over 12 hours because I ate at this garbage dump. The reason I know it was them? My girl is laying next to me puking as well. And the only place we both ate together less than 24 hours ago was there.

The incompetent staff that happens to grace this poorly operating business cannot tell the difference between a large drink and a medium and take over 10 minutes to make two identical sandwiches.

After we got home and ate them, fast forward 6 hours and we are both puking our brains out.

The most common reason for this to happen is when an employee does not wash their hands after getting feces on them. Then they touch my food and I get sick. Based on the staff that day, it does not surprise me one bit.

I would recommend starving over going here. Never again. Now I will go speak to Ralph on the big white telephone some more."
1,The worse food and service. I have never given a bad review. I ordered a shrimp dish with brown rice. The waiter brought out white rice. The sauce was horrible and bland. The calamari salad was not fresh. The dressing was bland too. The waitress checked on us and we asked for check immediately.  She never asked if anything was wrong or if the food was good. I would never recommend or eat here again. The service and food was horrible. I was visiting from out of town and was hoping to get a new experience.  This was not it...
1,"I give this location no love.  We went to this one rather than the one uptown on a Saturday night with a voucher from another location from a bad sushi upchuck experience.  Going late at night with a mostly empty restaurant, we still ended up waiting 10 minutes to be sat, then SHOVED and I mean shoved in next to the only other table in the place - the hostess snickered at me when I kindly asked to move a single table down (really sick of bitchy hostesses in Scottsdale by the way - your job is not that hard so shut up and color for christs sake)  Our waitress took another 10 minutes just to greet us, sushi took forever, and if you can believe it the fun hadnt even begun yet.  
When paying the bill, we present the voucher to the waitress, who says she cant take it.  The manager came over with a bitchy look, basically trying to call it bull shyt and continued to give us the 5th degree about it for the next few minutes - certainly NOT appreciated.  She takes it to the point where she calls the other location where we got it (taking ANOTHER 10 minutes) and finally gives us our bill back - only taking off our 2 rolls and 2 nigiri.  This created one pissed off yelper instantaneously.

Don't bother with this location - you could find bomb shrapnel in your soup and they still wouldnt give a damn.  

And for the sake of all that is holy - STOP WITH THE CRAZY I'M-TOO-SEXY-FOR-MYSELF SCENE!  YOU'RE NOT THAT COOL!"
1,"despite it's billing as the 'largest thrift store in north america,' i'm pretty sure this is the island of misfit goodwill items. the place is huge, but i've never, ever found anything good in this store. i'm not sure how that's possible. but i would never go out of my way to shop here.

i have no bathroom report for this location because i've never been in there long enough to actually go."
1,"Pros: 
-No breed restrictions on dogs
-Washer and dryer in unit

Cons: 
-Awful and idiotic leasing staff. Forms will be missing or prepared incorrectly.
-Rude and inadequate maintenance (be prepared to supply your own tools half of the time)
-Trash divers daily that no one does anything about
-No on-site security (you can call after 9 pm for a ""courtesy patrol"" but it takes them hours to arrive) and the front gate is NEVER closed
-Vandalized cars 
-A MURDER (this was the location of the man who set his pregnant girl friend on fire)
-The main pool is beautifully maintained and clean. The 3 other pools are small, dirty, and frequently closed. 
-Bug infestations in most apartments
-Dogs kept on patios 24/7 (a clear violation of the lease) so their barking can be heard by all
-The basketball court and tennis courts are never available, as they are constantly used by kids to bike ride on with the encouragement of the apartment staff
-Tons of potholes! Driving through the parking lot requires excellent shocks and there is minimal guest parking
-The apartments have less insulation than a cardboard box. Freezing in the winter, sweltering in the summer. Nothing is fitted correctly to it's frame, either. 

If you can afford a better place, I highly reccommend it."
1,We bought or second Jura Compressa coffee machine from Sur La Table.  It was an expensive model priced over $3K.  After 2.5 short months it stopped working.  The only  option they offered was to send it in for repair.  When I asked to have it replaced I was told the turn around was 48 hours.  Its actually 4 -5 weeks when all is said and done.  I high priced item and thats the kind of customer service. Not to mention an expensive product that cant make it 90 days.  Extremely bad customer service on this one.
1,"Would have to agree with Rana A below... I think she said it best

Actually, I had several folks tell me this place was lousy before I went... it even fell below my already low expectations...

Given that I just left the real Barcelona (in Spain)- part of me was truly crying inside that night. OK, I gotta admit- everytime I tell someone I was just in Barcelona (the city) and they say ""you mean the one in Scottsdale"" there is a part of me that wants to just pack my bags and fly back..."
1,"Sadly disappointed.  I've passed Lola's an uncountable number of times and each time thought I needed to try it.  I finally did tonight and was terribly disappointed.  For anyone that has been to Firefly in Las Vegas there is just no comparison.  The sangria was decent but nothing special and the tapas were just ""so so.""  The atmosphere was busy and our service sucked, but it was a very unique and cool environment."
1,"Well, I guess the bar is much lower in Flagstaff, as we went to their restaurant in Glendale for breakfast.  It was less than mediocre.  Starting with the coffee, which tasted awful..it was very bitter and watching the waitress pour old decaffinated coffee into a regular coffee pot! Unacceptable.  I had bacon and eggs...fair. Asked for the hashbrowns to be well done..didn't make a difference, I guess, as they came out raw.  Also, asked that my toast be dry...came out saturated with butter.  My husband had the chicken fried steak with gravy...you could have plastered a house with the gravy!  As you can tell, we will not be returning.  The reason we went, was because of their article in the paper this week.  Just shows, that you can't believe believe everything you read.  My husband, ""jokingly, suggested, that we cancel the paper!"
1,"The only reason 1 star can be given is the flavor choices and taste.  The SMALLEST wings I have ever seen, they must be off of baby chicks.  I thought it was getting punked, actually LOL.  Never to be back"
1,"Bad quality ingredients. I ordered a red curry beef and the beef was awful, hard, I tried to chew it for a minute and decided to give up."
1,"Not worth comin here. I'm all for food like this but this restaurant sucks. They gave me and my dad the wrong meal, and the food was not that good. The meat was dry and the rice was cold. Not worth it."
1,"Boy is the name a temptation.Seriously :)  I'll try to be fair though but I'm writing at a time were this restaurant was truly life changing. So much so that I'm buying a dining room table, additional gear for the kitchen and not frequenting any chain while I'm in my hometown based on the strength of this experience. Even in a good mood this place wouldn't be breaking a 2.5 . I'm not in a good mood.  

Texas cheese fries. Pretty tasteless,mess of uncrisp steak fries that are meant to be Monterrey jack , cheddar and bacon. Either the cheese mixed itself together really well or that's not what I had. Bacon , mm that is a very generous term for the toe nail clippings of meat that ended up atop it. Saving grace was only ordering 1/2 an order.

Kid's meal.  Holy crap dried and scraggly carrots accompanied the most basic hot dog imaginable on the most generic bun. No refill offered this time on drink, no straw either.   By far the most cynical  kid's meal I've met. Sure make a profit but don't take the piss!  Fresh carrots are not hard to do , with white film on them.. sorry you've just earned a  1 star. Should have walked out, didn't. :( 

Entrees.

Cajun steak . Claims to be marinated in spices that I couldn't find. They may indeed have shown them a picture of the process in the recipe but I couldn't find it. Meant to be medium rare but was medium on one side , rare on the other, close though:) 

Sirloin steak. Cooked as requested , a bit over seasoned. 

Sides: Twice baked potato.  If you ever want to open up a salt mine these guy will do it for you. You want an idea of what it's texture was?  Twice chewed would be a better name. Warm vomit with bacon bits would be  a slightly more colorful, and chunky, term.

Fried onions:   came with whatever was stuck to the grill they came from.The mushrooms were the only thing that were as tasteful as expected. They looked very consistent though,  canned?   Never mind they were edible: 

Steak soup,really more a stew,but tasted pretty good.  Overall service was ok'ish but walking the kid to the toilet twice the staff just seemed  to want to get to where they wanted to go and not care for the toddler walking up the aisle to the restroom in front of me.  ( that's for this occasion only , past two times it's been great fun for the kid,)

1.5 rounded to 1 for the carrots."
1,"Oh boy.. I usually LOVE LOVE Mucho Gusto.. but NO ME GUSTA today!

We got a to go order, perhaps that was mistake numero uno.  I got the nachos.. really, you can't mess those up... Or so I thouhgt! I mean Filiberto's would have been a better choice!  Can you say cold soggy mess.. maybe that was my fault. I will accept the blame. I really should have known better. 

Mistake numero dos... What do you call Shrimp Cocktail with out the shrimp?? Bad Service! Lack of quality control....Really.. Really? You forgot the shimp? How do you do that.... Better question WHO DOES THAT?

Mistake numero tres...lemme just say burned tasting chips (as opposed to my soggy nacho chips) and left an acrid taste in ones mouth and the most offending guacamole that I have ever had. 

Let me just say that my co worker and I eat here frequently enough that we can order for each other. We also know to order our guacamole with out the Grand Marnier galze thingy on top.  

Mucho Gusto you mucho FAILED me today.  I hate leaving a bad review without first compaining to management so expect a phone call from me shortly."
1,"My g/f love sushi! She made me a connosiuer of it. and I have to be critical. So many college kids ""love"" RA, but it's mediocre at best.

I'll just list a few things that irk me:
I went during a happy hour with co-workers. It was PACKED. Good thing, right? WRONG!
Extremely poor service. when I went in to meet coworkers who already had a table the hostess told me I have to wait. When I said I have a table, she got in my face. I was tired, long-day and I wanted to chill. I walked past her, found my friends, and she left me alone.
The waitress took quite a bit of time to get around to my table, and the sushi servings were OBVIOUSLY LOW!
I went to Zen 32, and now my choice is SakeBomber. their happy hour servings are much more than RA, and their prices are BETTER!

Be ready for loud noises, as every one is trying to talk louder than the music, and the person next to them.

Just an overall poor experience. and I tip on service. 

Food quality was so-so. Just don't go during a happy hour, which is the only time it's worth it because it's priced so high."
1,"I parked in the Parking Garage, got my parking ticket validated, and still owed money for parking.  The parking validation was worth $3.00.  The charge for parking was $5.00 with $2.00 credit for the validation (not the $3.00 I was promised).  I paid the remaining $3.00 charge, but then, the machine wouldn't give me a receipt.

I am never going back to this location.  It is off my radar from now on."
1,"So a friend of mine went here last Friday, and they were double charged.  The bartender took advantage of the situation and threw out the receipt to avoid cancelling the $60 amount. Which she claims and assumes was her tip (on a $60 bill). ""I get a 100% tips!"" umm..yeah.. I think I will skip this place for sure!"
